{
  "prototype_id": "static_opt",
  "item_id": "rotator_cuff_force_couple",
  "fps": 30,
  "bones": [
    [
      "pelvis",
      "hip"
    ],
    [
      "hip",
      "knee"
    ],
    [
      "knee",
      "ankle"
    ],
    [
      "pelvis",
      "shoulder"
    ],
    [
      "shoulder",
      "elbow"
    ],
    [
      "elbow",
      "wrist"
    ]
  ],
  "frames": [
    {
      "t": 0.0,
      "joints": {
        "pelvis": [
          0.0,
          0.95,
          0.0
        ],
        "hip": [
          0.0,
          0.87,
          0.15
        ],
        "knee": [
          0.0,
          0.45,
          0.15
        ],
        "ankle": [
          0.0,
          0.05,
          0.15
        ],
        "shoulder": [
          0.0,
          1.47,
          0.18
        ],
        "elbow": [
          0.0,
          1.21019,
          0.33
        ],
        "wrist": [
          0.24432,
          1.13318,
          0.37446
        ]
      },
      "muscles": {
        "biceps_brachii": {
          "role": "inactive",
          "polyline": [
            [
              0.03,
              1.505,
              0.17
            ],
            [
              0.05656,
              1.22217,
              0.33232
            ]
          ]
        },
        "brachialis": {
          "role": "inactive",
          "polyline": [
            [
              0.016,
              1.33144,
              0.26
            ],
            [
              0.03905,
              1.21447,
              0.32753
            ]
          ]
        },
        "brachioradialis": {
          "role": "inactive",
          "polyline": [
            [
              0.006,
              1.25816,
              0.32309
            ],
            [
              0.22092,
              1.16146,
              0.37661
            ]
          ]
        },
        "triceps_brachii": {
          "role": "inactive",
          "polyline": [
            [
              -0.02,
              1.435,
              0.17
            ],
            [
              -0.01642,
              1.17113,
              0.35255
            ],
            [
              0.03263,
              1.18148,
              0.34658
            ]
          ]
        },
        "anterior_deltoid": {
          "role": "inactive",
          "polyline": [
            [
              0.055,
              1.525,
              0.16
            ],
            [
              0.018,
              1.35043,
              0.26289
            ]
          ]
        },
        "posterior_deltoid": {
          "role": "inactive",
          "polyline": [
            [
              -0.06,
              1.505,
              0.155
            ],
            [
              -0.016,
              1.35243,
              0.26636
            ]
          ]
        },
        "gluteus_maximus": {
          "role": "inactive",
          "polyline": [
            [
              -0.09,
              0.99,
              0.11
            ],
            [
              -0.1,
              0.85,
              0.16
            ],
            [
              -0.055,
              0.8,
              0.16
            ]
          ]
        },
        "biceps_femoris": {
          "role": "inactive",
          "polyline": [
            [
              -0.05,
              0.835,
              0.14
            ],
            [
              -0.028,
              0.395,
              0.165
            ]
          ]
        },
        "vastus_lateralis": {
          "role": "inactive",
          "polyline": [
            [
              0.028,
              0.72,
              0.175
            ],
            [
              0.048,
              0.45,
              0.162
            ],
            [
              0.03,
              0.39,
              0.158
            ]
          ]
        },
        "iliopsoas": {
          "role": "inactive",
          "polyline": [
            [
              0.065,
              1.01,
              0.11
            ],
            [
              0.028,
              0.83,
              0.15
            ]
          ]
        },
        "infraspinatus": {
          "role": "prime_mover",
          "polyline": [
            [
              -0.048,
              1.425,
              0.152
            ],
            [
              -0.024,
              1.45575,
              0.21132
            ]
          ]
        },
        "teres_minor": {
          "role": "synergist",
          "polyline": [
            [
              -0.042,
              1.375,
              0.144
            ],
            [
              -0.02,
              1.43643,
              0.21786
            ]
          ]
        },
        "subscapularis": {
          "role": "inactive",
          "polyline": [
            [
              0.008,
              1.415,
              0.146
            ],
            [
              0.024,
              1.44102,
              0.1898
            ]
          ]
        },
        "supraspinatus": {
          "role": "inactive",
          "polyline": [
            [
              -0.02,
              1.49,
              0.14
            ],
            [
              0.0,
              1.47934,
              0.21618
            ]
          ]
        },
        "middle_trapezius": {
          "role": "inactive",
          "polyline": [
            [
              -0.07,
              1.39,
              0.0
            ],
            [
              -0.02,
              1.45,
              0.185
            ]
          ]
        },
        "lower_trapezius": {
          "role": "inactive",
          "polyline": [
            [
              -0.06,
              1.17,
              0.0
            ],
            [
              -0.028,
              1.46,
              0.17
            ]
          ]
        },
        "rhomboid_major": {
          "role": "inactive",
          "polyline": [
            [
              -0.065,
              1.33,
              0.0
            ],
            [
              -0.02,
              1.41,
              0.125
            ]
          ]
        },
        "latissimus_dorsi": {
          "role": "inactive",
          "polyline": [
            [
              -0.05,
              1.13,
              0.07
            ],
            [
              0.02,
              1.44036,
              0.20866
            ]
          ]
        },
        "pectoralis_major": {
          "role": "inactive",
          "polyline": [
            [
              0.075,
              1.35,
              0.08
            ],
            [
              0.016,
              1.44263,
              0.21659
            ]
          ]
        }
      }
    },
    {
      "t": 0.03333,
      "joints": {
        "pelvis": [
          0.0,
          0.95,
          0.0
        ],
        "hip": [
          0.0,
          0.87,
          0.15
        ],
        "knee": [
          0.0,
          0.45,
          0.15
        ],
        "ankle": [
          0.0,
          0.05,
          0.15
        ],
        "shoulder": [
          0.0,
          1.47,
          0.18
        ],
        "elbow": [
          0.0,
          1.21019,
          0.33
        ],
        "wrist": [
          0.24432,
          1.13349,
          0.375
        ]
      },
      "muscles": {
        "biceps_brachii": {
          "role": "inactive",
          "polyline": [
            [
              0.03,
              1.505,
              0.17
            ],
            [
              0.05654,
              1.22224,
              0.33245
            ]
          ]
        },
        "brachialis": {
          "role": "inactive",
          "polyline": [
            [
              0.016,
              1.33146,
              0.26004
            ],
            [
              0.03905,
              1.21452,
              0.32761
            ]
          ]
        },
        "brachioradialis": {
          "role": "inactive",
          "polyline": [
            [
              0.00595,
              1.25817,
              0.3231
            ],
            [
              0.22088,
              1.16174,
              0.3771
            ]
          ]
        },
        "triceps_brachii": {
          "role": "inactive",
          "polyline": [
            [
              -0.02,
              1.435,
              0.17
            ],
            [
              -0.01642,
              1.17111,
              0.35252
            ],
            [
              0.03263,
              1.18152,
              0.34665
            ]
          ]
        },
        "anterior_deltoid": {
          "role": "inactive",
          "polyline": [
            [
              0.055,
              1.525,
              0.16
            ],
            [
              0.01797,
              1.35045,
              0.26293
            ]
          ]
        },
        "posterior_deltoid": {
          "role": "inactive",
          "polyline": [
            [
              -0.06,
              1.505,
              0.155
            ],
            [
              -0.01604,
              1.35241,
              0.26632
            ]
          ]
        },
        "gluteus_maximus": {
          "role": "inactive",
          "polyline": [
            [
              -0.09,
              0.99,
              0.11
            ],
            [
              -0.1,
              0.85,
              0.16
            ],
            [
              -0.055,
              0.8,
              0.16
            ]
          ]
        },
        "biceps_femoris": {
          "role": "inactive",
          "polyline": [
            [
              -0.05,
              0.835,
              0.14
            ],
            [
              -0.028,
              0.395,
              0.165
            ]
          ]
        },
        "vastus_lateralis": {
          "role": "inactive",
          "polyline": [
            [
              0.028,